"Status","Start Time","Stop Time","Duration in ms","Parent Suite","Suite","Sub Suite","Test Class","Test Method","Name","Description"
"passed","Fri Jun 17 13:05:41 UTC 2022","Fri Jun 17 13:06:25 UTC 2022","44228","","The ""Sales Manager"" can't delete an existing project","","The ""Sales Manager"" can't delete an existing project","Should verify that ""Sales Manager"" can't delete created project testProject1","Should verify that ""Sales Manager"" can't delete created project testProject1",""
"passed","Fri Jun 17 12:57:11 UTC 2022","Fri Jun 17 12:57:14 UTC 2022","2464","","C3,C4,C5,C6,C12: Login","","C3,C4,C5,C6,C12: Login","C3: Login as ""Scheduler"" role with valid credentials.","C3: Login as ""Scheduler"" role with valid credentials.",""
"passed","Fri Jun 17 13:08:51 UTC 2022","Fri Jun 17 13:09:27 UTC 2022","35874","","C123: Edit an existing template","","C123: Edit an existing template","Should add new inputs for existing template.","Should add new inputs for existing template.",""
"passed","Fri Jun 17 13:16:00 UTC 2022","Fri Jun 17 13:16:18 UTC 2022","17817","","C17: The scheduler can edit an existing input field.","","C17: The scheduler can edit an existing input field.","Should verify that input is deleted in reserve form","Should verify that input is deleted in reserve form",""
"passed","Fri Jun 17 13:17:37 UTC 2022","Fri Jun 17 13:17:54 UTC 2022","16519","","C19: The scheduler can delete an input field for an existing column","","C19: The scheduler can delete an input field for an existing column","Should verify that input is deleted in reserve form","Should verify that input is deleted in reserve form",""
"passed","Fri Jun 17 13:14:51 UTC 2022","Fri Jun 17 13:15:10 UTC 2022","18361","","C16: The scheduler can delete an existing column","","C16: The scheduler can delete an existing column","Should click the ""Update Form Structure"" button.","Should click the ""Update Form Structure"" button.",""
"passed","Fri Jun 17 13:07:36 UTC 2022","Fri Jun 17 13:07:38 UTC 2022","2014","","C120: Save a form structure as a new template for other structures","","C120: Save a form structure as a new template for other structures","Should select a project type and click the ""Edit"" icon rightward.","Should select a project type and click the ""Edit"" icon rightward.",""
"passed","Fri Jun 17 13:11:56 UTC 2022","Fri Jun 17 13:12:19 UTC 2022","22762","","C126: Select ""non template"" from the drop-down menu","","C126: Select ""non template"" from the drop-down menu","Should click the ""Update Schedule"" button.","Should click the ""Update Schedule"" button.",""
"passed","Fri Jun 17 13:15:36 UTC 2022","Fri Jun 17 13:15:55 UTC 2022","18700","","C17: The scheduler can edit an existing input field.","","C17: The scheduler can edit an existing input field.","Should click the ""Update Form Structure"" button.","Should click the ""Update Form Structure"" button.",""
"passed","Fri Jun 17 13:18:20 UTC 2022","Fri Jun 17 13:18:41 UTC 2022","20923","","C24: The scheduler can create input field for and existing column with any type","","C24: The scheduler can create input field for and existing column with any type","Should add new inputs for created culumn.","Should add new inputs for created culumn.",""
"passed","Fri Jun 17 13:13:10 UTC 2022","Fri Jun 17 13:13:17 UTC 2022","7235","","C127: Create a form structure with required field (text)","","C127: Create a form structure with required field (text)","Should add new required input for created culumn.","Should add new required input for created culumn.",""
"failed","Fri Jun 17 13:07:06 UTC 2022","Fri Jun 17 13:07:17 UTC 2022","11190","","C52: Creating a new project in an available slot without any name and any start date","","C52: Creating a new project in an available slot without any name and any start date","""before all"" hook for C52: Creating a new project in an available slot without any name and any start date","""before all"" hook for C52: Creating a new project in an available slot without any name and any start date",""
"passed","Fri Jun 17 12:57:14 UTC 2022","Fri Jun 17 12:57:16 UTC 2022","2196","","C3,C4,C5,C6,C12: Login","","C3,C4,C5,C6,C12: Login","C5: Login with invalid password at Staging server.","C5: Login with invalid password at Staging server.",""
"passed","Fri Jun 17 13:20:26 UTC 2022","Fri Jun 17 13:20:29 UTC 2022","2688","","C14: The scheduler can add a configuration with certain date for the United States of America country","","C14: The scheduler can add a configuration with certain date for the United States of America country","Should click the ""Update Schedule"" button.","Should click the ""Update Schedule"" button.",""
"passed","Fri Jun 17 13:13:17 UTC 2022","Fri Jun 17 13:13:33 UTC 2022","15967","","C127: Create a form structure with required field (text)","","C127: Create a form structure with required field (text)","Should verify that created required field is displayed in form structure.","Should verify that created required field is displayed in form structure.",""
"passed","Fri Jun 17 13:19:01 UTC 2022","Fri Jun 17 13:19:06 UTC 2022","4592","","C29: Verify that scheduler can't create empty ""input type"".","","C29: Verify that scheduler can't create empty ""input type"".","Should click the ""Update Schedule"" button.","Should click the ""Update Schedule"" button.",""
"passed","Fri Jun 17 13:19:26 UTC 2022","Fri Jun 17 13:19:42 UTC 2022","16039","","С10: The scheduler can edit date at existing configuration","","С10: The scheduler can edit date at existing configuration","Should edit newly created configuration.","Should edit newly created configuration.",""
"passed","Fri Jun 17 13:08:01 UTC 2022","Fri Jun 17 13:08:06 UTC 2022","4648","","C121: Inability to save a template with empty name","","C121: Inability to save a template with empty name","Should click the ""Update Schedule"" button.","Should click the ""Update Schedule"" button.",""
